<?xml version="1.0" encoding="UTF-8"?>
<glossaire xmlns:xsi="http://www.w3.org/2001/XMLSchema-instance"
           xsi:noNamespaceSchemaLocation="../schemas/glossaire-v4.xsd"
           xml:lang="fr">
   <metadonnees>
      <dc:title xmlns:dc="http://purl.org/dc/elements/1.1/">Glossaire</dc:title>
      <dc:creator xmlns:dc="http://purl.org/dc/elements/1.1/">Moret Alexandre</dc:creator>
      <dc:language xmlns:dc="http://purl.org/dc/elements/1.1/">fr</dc:language>
      <dc:source xmlns:dc="http://purl.org/dc/elements/1.1/">Guillaume de Boldensele</dc:source>
   </metadonnees>
   <liste-termes>
      <terme id="gls-0001">
         <liste-formes>
            <forme type="lemme">
               <graphie xml:lang="la"/>
               <categorie_grammaticale>À compléter</categorie_grammaticale>
               <liste-attestations>
                  <attestation idref="#w-0005">
                     <localisation>
                        <ref-folio cote="v">236</ref-folio>
                     </localisation>
                  </attestation>
                  <attestation idref="#w-0013">
                     <localisation>
                        <ref-folio cote="v">236</ref-folio>
                     </localisation>
                  </attestation>
                  <attestation idref="#w-0016">
                     <localisation>
                        <ref-folio cote="v">236</ref-folio>
                     </localisation>
                  </attestation>
                  <attestation idref="#w-0104">
                     <localisation>
                        <ref-folio cote="v">236</ref-folio>
                     </localisation>
                  </attestation>
                  <attestation idref="#w-0114">
                     <localisation>
                        <ref-folio cote="v">236</ref-folio>
                     </localisation>
                  </attestation>
               </liste-attestations>
            </forme>
         </liste-formes>
         <nombre-occurrences>5</nombre-occurrences>
         <definition>À compléter</definition>
      </terme>
      <terme id="gls-0002">
         <liste-formes>
            <forme type="lemme">
               <graphie xml:lang="la">abinuicem</graphie>
               <categorie_grammaticale>À compléter</categorie_grammaticale>
               <liste-attestations>
                  <attestation idref="#w-0042">
                     <localisation>
                        <ref-folio cote="v">236</ref-folio>
                     </localisation>
                  </attestation>
               </liste-attestations>
            </forme>
         </liste-formes>
         <nombre-occurrences>1</nombre-occurrences>
         <definition>À compléter</definition>
      </terme>
      <terme id="gls-0003">
         <liste-formes>
            <forme type="lemme">
               <graphie xml:lang="la">aeris</graphie>
               <categorie_grammaticale>À compléter</categorie_grammaticale>
               <liste-attestations>
                  <attestation idref="#w-0127">
                     <localisation>
                        <ref-folio cote="v">236</ref-folio>
                     </localisation>
                  </attestation>
               </liste-attestations>
            </forme>
         </liste-formes>
         <nombre-occurrences>1</nombre-occurrences>
         <definition>À compléter</definition>
      </terme>
      <terme id="gls-0004">
         <liste-formes>
            <forme type="lemme">
               <graphie xml:lang="la">alexandre</graphie>
               <categorie_grammaticale>À compléter</categorie_grammaticale>
               <liste-attestations>
                  <attestation idref="#w-0097">
                     <localisation>
                        <ref-folio cote="v">236</ref-folio>
                     </localisation>
                  </attestation>
               </liste-attestations>
            </forme>
         </liste-formes>
         <nombre-occurrences>1</nombre-occurrences>
         <definition>À compléter</definition>
      </terme>
      <terme id="gls-0005">
         <liste-formes>
            <forme type="lemme">
               <graphie xml:lang="la">angelicis</graphie>
               <categorie_grammaticale>À compléter</categorie_grammaticale>
               <liste-attestations>
                  <attestation idref="#w-0082">
                     <localisation>
                        <ref-folio cote="v">236</ref-folio>
                     </localisation>
                  </attestation>
               </liste-attestations>
            </forme>
         </liste-formes>
         <nombre-occurrences>1</nombre-occurrences>
         <definition>À compléter</definition>
      </terme>
      <terme id="gls-0006">
         <liste-formes>
            <forme type="lemme">
               <graphie xml:lang="la">apparenti</graphie>
               <categorie_grammaticale>À compléter</categorie_grammaticale>
               <liste-attestations>
                  <attestation idref="#w-0091">
                     <localisation>
                        <ref-folio cote="v">236</ref-folio>
                     </localisation>
                  </attestation>
               </liste-attestations>
            </forme>
         </liste-formes>
         <nombre-occurrences>1</nombre-occurrences>
         <definition>À compléter</definition>
      </terme>
      <terme id="gls-0007">
         <liste-formes>
            <forme type="lemme">
               <graphie xml:lang="la">armatam</graphie>
               <categorie_grammaticale>À compléter</categorie_grammaticale>
               <liste-attestations>
                  <attestation idref="#w-0022">
                     <localisation>
                        <ref-folio cote="v">236</ref-folio>
                     </localisation>
                  </attestation>
               </liste-attestations>
            </forme>
         </liste-formes>
         <nombre-occurrences>1</nombre-occurrences>
         <definition>À compléter</definition>
      </terme>
      <terme id="gls-0008">
         <liste-formes>
            <forme type="lemme">
               <graphie xml:lang="la">ascendi</graphie>
               <categorie_grammaticale>À compléter</categorie_grammaticale>
               <liste-attestations>
                  <attestation idref="#w-0025">
                     <localisation>
                        <ref-folio cote="v">236</ref-folio>
                     </localisation>
                  </attestation>
               </liste-attestations>
            </forme>
         </liste-formes>
         <nombre-occurrences>1</nombre-occurrences>
         <definition>À compléter</definition>
      </terme>
      <terme id="gls-0009">
         <liste-formes>
            <forme type="lemme">
               <graphie xml:lang="la">asserunt</graphie>
               <categorie_grammaticale>À compléter</categorie_grammaticale>
               <liste-attestations>
                  <attestation idref="#w-0094">
                     <localisation>
                        <ref-folio cote="v">236</ref-folio>
                     </localisation>
                  </attestation>
               </liste-attestations>
            </forme>
         </liste-formes>
         <nombre-occurrences>1</nombre-occurrences>
         <definition>À compléter</definition>
      </terme>
      <terme id="gls-0010">
         <liste-formes>
            <forme type="lemme">
               <graphie xml:lang="la">attingit</graphie>
               <categorie_grammaticale>À compléter</categorie_grammaticale>
               <liste-attestations>
                  <attestation idref="#w-0050">
                     <localisation>
                        <ref-folio cote="v">236</ref-folio>
                     </localisation>
                  </attestation>
               </liste-attestations>
            </forme>
         </liste-formes>
         <nombre-occurrences>1</nombre-occurrences>
         <definition>À compléter</definition>
      </terme>
      <terme id="gls-0011">
         <liste-formes>
            <forme type="lemme">
               <graphie xml:lang="la">austram</graphie>
               <categorie_grammaticale>À compléter</categorie_grammaticale>
               <liste-attestations>
                  <attestation idref="#w-0048">
                     <localisation>
                        <ref-folio cote="v">236</ref-folio>
                     </localisation>
                  </attestation>
               </liste-attestations>
            </forme>
         </liste-formes>
         <nombre-occurrences>1</nombre-occurrences>
         <definition>À compléter</definition>
      </terme>
      <terme id="gls-0012">
         <liste-formes>
            <forme type="lemme">
               <graphie xml:lang="la">beatus</graphie>
               <categorie_grammaticale>À compléter</categorie_grammaticale>
               <liste-attestations>
                  <attestation idref="#w-0073">
                     <localisation>
                        <ref-folio cote="v">236</ref-folio>
                     </localisation>
                  </attestation>
               </liste-attestations>
            </forme>
         </liste-formes>
         <nombre-occurrences>1</nombre-occurrences>
         <definition>À compléter</definition>
      </terme>
      <terme id="gls-0013">
         <liste-formes>
            <forme type="lemme">
               <graphie xml:lang="la">bene</graphie>
               <categorie_grammaticale>À compléter</categorie_grammaticale>
               <liste-attestations>
                  <attestation idref="#w-0021">
                     <localisation>
                        <ref-folio cote="v">236</ref-folio>
                     </localisation>
                  </attestation>
               </liste-attestations>
            </forme>
         </liste-formes>